{
  "schema_version": "0.1",
  "generated_at": "2026-06-01T04:39:36.886188Z",
  "source_artifacts": {
    "render_captures": "/Users/kangmin/Documents/excel-workbook-editing/review-packages/workbook-understanding/mbp-2026-02-render-captures.json"
  },
  "method": {
    "name": "deterministic_png_capture_quality",
    "thresholds": {
      "min_height_px_fail": 50,
      "min_height_px_warn": 120,
      "min_pixels_per_row_fail": 4.0,
      "min_pixels_per_row_warn": 8.0,
      "min_pixels_per_column_fail": 4.0,
      "min_pixels_per_column_warn": 8.0,
      "aspect_ratio_fail": 25.0,
      "aspect_ratio_warn": 12.0,
      "wide_capture_width_warn": 2200,
      "wide_capture_column_warn": 35,
      "visible_pixel_ratio_fail": 0.002,
      "visible_pixel_ratio_warn": 0.01
    }
  },
  "quality_results": [
    {
      "id": "quality_capture_target_결제_수수료_cell_region_1",
      "type": "capture_quality_result",
      "status": "usable",
      "capture_id": "capture_target_결제_수수료_cell_region_1",
      "target_id": "target_결제_수수료_cell_region_1",
      "sheet": "결제&수수료",
      "requested_range": "A1:C11",
      "capture_window_range": "A1:D13",
      "png_path": "/Users/kangmin/Documents/excel-workbook-editing/review-packages/workbook-understanding/render-captures/captures/capture_001_57389d2f28.png",
      "dimensions": {
        "width": 341,
        "height": 222,
        "size_bytes": 15921
      },
      "range_shape": {
        "status": "parsed",
        "min_row": 1,
        "min_column": 1,
        "max_row": 13,
        "max_column": 4,
        "row_count": 13,
        "column_count": 4
      },
      "metrics": {
        "aspect_ratio": 1.536,
        "pixels_per_row": 17.0769,
        "pixels_per_column": 85.25,
        "visible_pixel_ratio": 0.214037,
        "alpha_coverage_ratio": 0.215661
      },
      "checks": [
        {
          "id": "capture_status",
          "type": "capture_quality_check",
          "status": "pass",
          "severity": "info",
          "message": "Render capture status is captured."
        },
        {
          "id": "png_file_exists",
          "type": "capture_quality_check",
          "status": "pass",
          "severity": "info",
          "message": "PNG file exists: /Users/kangmin/Documents/excel-workbook-editing/review-packages/workbook-understanding/render-captures/captures/capture_001_57389d2f28.png"
        },
        {
          "id": "dimensions_available",
          "type": "capture_quality_check",
          "status": "pass",
          "severity": "info",
          "message": "PNG dimensions are 341 x 222."
        },
        {
          "id": "height_readability",
          "type": "capture_quality_check",
          "status": "pass",
          "severity": "info",
          "message": "Capture image height should be large enough for visual review. 222 px is within threshold."
        },
        {
          "id": "pixels_per_row",
          "type": "capture_quality_check",
          "status": "pass",
          "severity": "info",
          "message": "Rows should have enough rendered height for visual gates. 17.0769 px/row is within threshold."
        },
        {
          "id": "pixels_per_column",
          "type": "capture_quality_check",
          "status": "pass",
          "severity": "info",
          "message": "Columns should have enough rendered width for visual gates. 85.25 px/column is within threshold."
        },
        {
          "id": "aspect_ratio",
          "type": "capture_quality_check",
          "status": "pass",
          "severity": "info",
          "message": "Aspect ratio 1.536 is reviewable."
        },
        {
          "id": "visible_content",
          "type": "capture_quality_check",
          "status": "pass",
          "severity": "info",
          "message": "Visible pixel ratio 0.214037 is above blank-image thresholds."
        },
        {
          "id": "wide_capture",
          "type": "capture_quality_check",
          "status": "pass",
          "severity": "info",
          "message": "Capture width does not require tiling by default."
        }
      ],
      "recommendations": [
        "accept_for_next_visual_gate"
      ],
      "evidence_refs": [
        "capture_target_결제_수수료_cell_region_1"
      ],
      "notes": "Capture quality checks passed."
    },
    {
      "id": "quality_capture_target_결제상세_cell_region_1",
      "type": "capture_quality_result",
      "status": "review_required",
      "capture_id": "capture_target_결제상세_cell_region_1",
      "target_id": "target_결제상세_cell_region_1",
      "sheet": "결제상세",
      "requested_range": "A1:AX20",
      "capture_window_range": "A1:AY22",
      "png_path": "/Users/kangmin/Documents/excel-workbook-editing/review-packages/workbook-understanding/render-captures/captures/capture_002_cd6f96738d.png",
      "dimensions": {
        "width": 3478,
        "height": 375,
        "size_bytes": 255814
      },
      "range_shape": {
        "status": "parsed",
        "min_row": 1,
        "min_column": 1,
        "max_row": 22,
        "max_column": 51,
        "row_count": 22,
        "column_count": 51
      },
      "metrics": {
        "aspect_ratio": 9.2747,
        "pixels_per_row": 17.0455,
        "pixels_per_column": 68.1961,
        "visible_pixel_ratio": 0.82814,
        "alpha_coverage_ratio": 0.830407
      },
      "checks": [
        {
          "id": "capture_status",
          "type": "capture_quality_check",
          "status": "pass",
          "severity": "info",
          "message": "Render capture status is captured."
        },
        {
          "id": "png_file_exists",
          "type": "capture_quality_check",
          "status": "pass",
          "severity": "info",
          "message": "PNG file exists: /Users/kangmin/Documents/excel-workbook-editing/review-packages/workbook-understanding/render-captures/captures/capture_002_cd6f96738d.png"
        },
        {
          "id": "dimensions_available",
          "type": "capture_quality_check",
          "status": "pass",
          "severity": "info",
          "message": "PNG dimensions are 3478 x 375."
        },
        {
          "id": "height_readability",
          "type": "capture_quality_check",
          "status": "pass",
          "severity": "info",
          "message": "Capture image height should be large enough for visual review. 375 px is within threshold."
        },
        {
          "id": "pixels_per_row",
          "type": "capture_quality_check",
          "status": "pass",
          "severity": "info",
          "message": "Rows should have enough rendered height for visual gates. 17.0455 px/row is within threshold."
        },
        {
          "id": "pixels_per_column",
          "type": "capture_quality_check",
          "status": "pass",
          "severity": "info",
          "message": "Columns should have enough rendered width for visual gates. 68.1961 px/column is within threshold."
        },
        {
          "id": "aspect_ratio",
          "type": "capture_quality_check",
          "status": "pass",
          "severity": "info",
          "message": "Aspect ratio 9.2747 is reviewable."
        },
        {
          "id": "visible_content",
          "type": "capture_quality_check",
          "status": "pass",
          "severity": "info",
          "message": "Visible pixel ratio 0.82814 is above blank-image thresholds."
        },
        {
          "id": "wide_capture",
          "type": "capture_quality_check",
          "status": "warning",
          "severity": "warning",
          "message": "Capture spans 51 columns at 3478px; tiling may improve reviewability."
        }
      ],
      "recommendations": [
        "recapture_with_tiling"
      ],
      "evidence_refs": [
        "capture_target_결제상세_cell_region_1"
      ],
      "notes": "review_required: wide_capture"
    },
    {
      "id": "quality_capture_target_당월산식_cell_region_1",
      "type": "capture_quality_result",
      "status": "recapture_required",
      "capture_id": "capture_target_당월산식_cell_region_1",
      "target_id": "target_당월산식_cell_region_1",
      "sheet": "당월산식",
      "requested_range": "A1:AZ20",
      "capture_window_range": "A1:BA22",
      "png_path": "/Users/kangmin/Documents/excel-workbook-editing/review-packages/workbook-understanding/render-captures/captures/capture_003_8c8cc45aab.png",
      "dimensions": {
        "width": 2311,
        "height": 69,
        "size_bytes": 20763
      },
      "range_shape": {
        "status": "parsed",
        "min_row": 1,
        "min_column": 1,
        "max_row": 22,
        "max_column": 53,
        "row_count": 22,
        "column_count": 53
      },
      "metrics": {
        "aspect_ratio": 33.4928,
        "pixels_per_row": 3.1364,
        "pixels_per_column": 43.6038,
        "visible_pixel_ratio": 0.750909,
        "alpha_coverage_ratio": 0.751591
      },
      "checks": [
        {
          "id": "capture_status",
          "type": "capture_quality_check",
          "status": "pass",
          "severity": "info",
          "message": "Render capture status is captured."
        },
        {
          "id": "png_file_exists",
          "type": "capture_quality_check",
          "status": "pass",
          "severity": "info",
          "message": "PNG file exists: /Users/kangmin/Documents/excel-workbook-editing/review-packages/workbook-understanding/render-captures/captures/capture_003_8c8cc45aab.png"
        },
        {
          "id": "dimensions_available",
          "type": "capture_quality_check",
          "status": "pass",
          "severity": "info",
          "message": "PNG dimensions are 2311 x 69."
        },
        {
          "id": "height_readability",
          "type": "capture_quality_check",
          "status": "warning",
          "severity": "warning",
          "message": "Capture image height should be large enough for visual review. 69 px is below warning threshold 120."